{"auditId":"55555555-5555-4555-8555-555555555555","subjectType":"Prediction","subjectId":"11111111-1111-4111-8111-111111111111","site":"LU","action":"PredictionRaised","inputsRef":["onelake://silver/features/lining/LU-BF1/2026-06-21T10:00:00Z","fixture://telemetry_reading.json#2"],"modelOrLogicVersion":"fabric-mlflow:rul-lining:7","output":{"predictionId":"11111111-1111-4111-8111-111111111111","kind":"LiningFailureRisk","confidence":0.91,"status":"Raised"},"reviewerId":null,"rationale":null,"timestamp":"2026-06-21T10:05:01Z","origin":"Synthetic","retentionClass":"PredictionDecisionAudit"}
